<?xml version="1.0" encoding="UTF-8"?>
<ns:Order xmlns:ns="Apertum" xmlns:xsi="http://www.w3.org/2001/XMLSchema-instance" xsi:schemaLocation="Apertum Apertum.xsd ">
  <ns:POHead>
    <ns:OrderDetails>
      <ns:SupplierOrderReference>Med2938</ns:SupplierOrderReference>
      <ns:BuyerOrderReference>Shap1029</ns:BuyerOrderReference>
      <ns:TextHeader>Purchase Order No PO200003</ns:TextHeader>
      <ns:TextFooter>Enjoy</ns:TextFooter>
      <ns:SupplierOrderDate>2002-12-02</ns:SupplierOrderDate>
      <ns:BuyerOrderDate>2012-12-02</ns:BuyerOrderDate>
    </ns:OrderDetails>
    <ns:Currency>
      <ns:CurrencyCode>EUR</ns:CurrencyCode>
    </ns:Currency>
    <ns:TermsOfPayment>
      <ns:Description>Net</ns:Description>
      <ns:NetDays>0</ns:NetDays>
      <ns:Discount1>
        <ns:Percentage>35</ns:Percentage>
        <ns:DaysDue>2032-01-10</ns:DaysDue>
      </ns:Discount1>
      <ns:Discount2>
        <ns:Percentage>10</ns:Percentage>
        <ns:DaysDue>2045-01-01</ns:DaysDue>
      </ns:Discount2>
    </ns:TermsOfPayment>
    <ns:TermsOfDelivery>
      <ns:DelivType></ns:DelivType>
      <ns:TransportType></ns:TransportType>
    </ns:TermsOfDelivery>
  </ns:POHead>
  <ns:Buyer>
    <ns:SupplierReferenceNo>Med2938</ns:SupplierReferenceNo>
    <ns:BuyerReferenceNo>Shap1029</ns:BuyerReferenceNo>
    <ns:VAT_RegistrationNo>IL 29091</ns:VAT_RegistrationNo>
    <ns:Address>
      <ns:Name1>Saron BenMoshe</ns:Name1>
	  <ns:Name2></ns:Name2>
      <ns:Street>Habareket</ns:Street>
      <ns:City>Petah Tikva</ns:City>
      <ns:State></ns:State>
      <ns:PostalCode>87665</ns:PostalCode>
      <ns:Country>Israel</ns:Country>
      <ns:CountryCode>IL</ns:CountryCode>
    </ns:Address>
    <ns:Contact>
      <ns:FirstName>Gad</ns:FirstName>
      <ns:LastName>Zur</ns:LastName>
      <ns:Title>Bsc</ns:Title>
      <ns:JobTItle>Engineer</ns:JobTItle>
      <ns:Phone>03-293833</ns:Phone>
      <ns:Fax>03-293833</ns:Fax>
      <ns:Email>gadz@medatech.com</ns:Email>
    </ns:Contact>
  </ns:Buyer>
  <ns:Supplier>
    <ns:SupplierReferenceNo>Med2938</ns:SupplierReferenceNo>
    <ns:BuyerReferenceNo>Shap1029</ns:BuyerReferenceNo>
    <ns:VAT_RegistrationNo>IL 29091</ns:VAT_RegistrationNo>
    <ns:Address>
      <ns:Name1>Medatech</ns:Name1>
	  <ns:Name2>Medatech</ns:Name2>
      <ns:Street>Hasadna 3</ns:Street>
      <ns:City>Tirat Carmel</ns:City>
      <ns:State></ns:State>
      <ns:PostalCode>33865</ns:PostalCode>
      <ns:Country>Israel</ns:Country>
      <ns:CountryCode>IL</ns:CountryCode>
    </ns:Address>
    <ns:Contact>
      <ns:FirstName>Meir</ns:FirstName>
      <ns:LastName>Gabay</ns:LastName>
      <ns:Title>Mr</ns:Title>
      <ns:JobTItle>Manager</ns:JobTItle>
      <ns:Phone>072-73645098</ns:Phone>
      <ns:Fax>072-73645098</ns:Fax>
      <ns:Email>meirg@medatech.com</ns:Email>
    </ns:Contact>
  </ns:Supplier>
  <ns:DeliverTo>
    <ns:SupplierReferenceNo>Med2938</ns:SupplierReferenceNo>
    <ns:BuyerReferenceNo>Shap1029</ns:BuyerReferenceNo>
    <ns:VAT_RegistrationNo>IL 29091</ns:VAT_RegistrationNo>
    <ns:Address>
      <ns:Name1>Shron Ben Moshe</ns:Name1>
	  <ns:Name2></ns:Name2>
      <ns:Street>Habarekt</ns:Street>
      <ns:City>Petah Tikva</ns:City>
      <ns:State></ns:State>
      <ns:PostalCode>87665</ns:PostalCode>
      <ns:Country>Israel</ns:Country>
      <ns:CountryCode>IL</ns:CountryCode>
    </ns:Address>
    <ns:Contact>
      <ns:FirstName>Oren</ns:FirstName>
      <ns:LastName>Vaisman</ns:LastName>
      <ns:Title>Mr</ns:Title>
      <ns:JobTItle>TechSupport</ns:JobTItle>
      <ns:Phone>03-948575</ns:Phone>
      <ns:Fax>03-948575</ns:Fax>
      <ns:Email>orenv@mail.com</ns:Email>
    </ns:Contact>
  </ns:DeliverTo>
  <ns:InvoiceTo>
    <ns:SupplierReferenceNo>Med2938</ns:SupplierReferenceNo>
    <ns:BuyerReferenceNo>Shap1029</ns:BuyerReferenceNo>
    <ns:VAT_RegistrationNo>IL 29091</ns:VAT_RegistrationNo>
    <ns:Address>
      <ns:Name1>Mor Shani</ns:Name1>
	  <ns:Name2>Mor Shani</ns:Name2>
      <ns:Street>Zahal</ns:Street>
      <ns:City>Herzeliya</ns:City>
      <ns:State></ns:State>
      <ns:PostalCode>56982</ns:PostalCode>
      <ns:Country>Israel</ns:Country>
      <ns:CountryCode>IL</ns:CountryCode>
    </ns:Address>
    <ns:Contact>
      <ns:FirstName>Mor</ns:FirstName>
      <ns:LastName>Shani</ns:LastName>
      <ns:Title>PHD</ns:Title>
      <ns:JobTItle>Manager</ns:JobTItle>
      <ns:Phone>052093843</ns:Phone>
      <ns:Fax>03-653092</ns:Fax>
      <ns:Email>mors@gmail.com</ns:Email>
    </ns:Contact>
  </ns:InvoiceTo>
  <ns:POLine>
    <ns:LineNo>1</ns:LineNo>
    <ns:Product>
      <ns:SupplierPartID>po73463</ns:SupplierPartID>
      <ns:SupplierPartDesc>reports in priority</ns:SupplierPartDesc>
      <ns:BuyerPartID>b276</ns:BuyerPartID>
      <ns:BuyerPartDesc>services medatech</ns:BuyerPartDesc>
      <ns:EAN>ask9303alk</ns:EAN>
    </ns:Product>
    <ns:Price>
      <ns:UnitPrice>200</ns:UnitPrice>
      <ns:PricePerUnitOfMeasure>200</ns:PricePerUnitOfMeasure>
      <ns:PriceQuotient>10000</ns:PriceQuotient>
    </ns:Price>
    <ns:Quantity>
      <ns:QuantityAmount>5</ns:QuantityAmount>
      <ns:PackCode></ns:PackCode>
      <ns:PackSize>45</ns:PackSize>
      <ns:UnitOfMeasure>unit</ns:UnitOfMeasure>
    </ns:Quantity>
    <ns:RequestedDeliveryDate>
      <ns:DateYear>2013</ns:DateYear>
      <ns:DateWeek>50</ns:DateWeek>
      <ns:Date>2013-07-20</ns:Date>
    </ns:RequestedDeliveryDate>
    <ns:Discount>
      <ns:Percentage>5</ns:Percentage>
      <ns:DaysDue>2030-12-20</ns:DaysDue>
    </ns:Discount>
    <ns:Amount>
      <ns:VAT_Rate>17</ns:VAT_Rate>
      <ns:VAT_Amount>670</ns:VAT_Amount>
      <ns:Amount_ExclVAT>10000</ns:Amount_ExclVAT>
      <ns:Amount_InclVAT>10679</ns:Amount_InclVAT>
    </ns:Amount>
  </ns:POLine>
  <ns:OrderTotal>
    <ns:NumberOfLines>1</ns:NumberOfLines>
    <ns:TotalAmount>
      <ns:VAT_Rate>17</ns:VAT_Rate>
      <ns:VAT_Amount>670</ns:VAT_Amount>
      <ns:Amount_ExclVAT>10000</ns:Amount_ExclVAT>
      <ns:Amount_InclVAT>10679</ns:Amount_InclVAT>
      <ns:VAT_AmountTotal>670</ns:VAT_AmountTotal>
    </ns:TotalAmount>
  </ns:OrderTotal>
</ns:Order>