<?xml version="1.0" encoding="UTF-8"?>
<ns:Order xmlns:ns="Apertum" xmlns:xsi="http://www.w3.org/2001/XMLSchema-instance" xsi:schemaLocation="Apertum Apertum.xsd ">
  <ns:POHead>
    <ns:OrderDetails>
      <ns:SupplierOrderReference>D92387</ns:SupplierOrderReference>
      <ns:BuyerOrderReference>CO23049</ns:BuyerOrderReference>
      <ns:TextHeader>Purchase Order No PO1300000292</ns:TextHeader>
      <ns:TextFooter>Enjoy</ns:TextFooter>
      <ns:SupplierOrderDate>2013-11-11</ns:SupplierOrderDate>
      <ns:BuyerOrderDate>2013-11-11</ns:BuyerOrderDate>
    </ns:OrderDetails>
    <ns:Currency>
      <ns:CurrencyCode>EUR</ns:CurrencyCode>
    </ns:Currency>
    <ns:TermsOfPayment>
      <ns:Description>Net 45</ns:Description>
      <ns:NetDays>45</ns:NetDays>
      <ns:Discount1>
        <ns:Percentage>10</ns:Percentage>
        <ns:DaysDue>2013-11-02</ns:DaysDue>
      </ns:Discount1>
      <ns:Discount2>
        <ns:Percentage>5</ns:Percentage>
        <ns:DaysDue>2013-12-01</ns:DaysDue>
      </ns:Discount2>
    </ns:TermsOfPayment>
    <ns:TermsOfDelivery>
      <ns:DelivType>Express Shipping with guaranteed delivery date</ns:DelivType>
      <ns:TransportType>sea</ns:TransportType>
    </ns:TermsOfDelivery>
  </ns:POHead>
  <ns:Buyer>
    <ns:SupplierReferenceNo>D92387</ns:SupplierReferenceNo>
    <ns:BuyerReferenceNo>CO23049</ns:BuyerReferenceNo>
    <ns:VAT_RegistrationNo>IL 123444</ns:VAT_RegistrationNo>
    <ns:Address>
      <ns:Name1>Daniela Levi</ns:Name1>
	  <ns:Name2></ns:Name2>
      <ns:Street>Marganit 7</ns:Street>
      <ns:City>Nesher</ns:City>
      <ns:State></ns:State>
      <ns:PostalCode>98833</ns:PostalCode>
      <ns:Country>Israel</ns:Country>
      <ns:CountryCode>IL</ns:CountryCode>
    </ns:Address>
    <ns:Contact>
      <ns:FirstName>Daniela</ns:FirstName>
      <ns:LastName>Levi</ns:LastName>
      <ns:Title>MR</ns:Title>
      <ns:JobTItle>Nurse</ns:JobTItle>
      <ns:Phone>04-293801</ns:Phone>
      <ns:Fax>04-653092</ns:Fax>
      <ns:Email>daniell@gmail.com</ns:Email>
    </ns:Contact>
  </ns:Buyer>
  <ns:Supplier>
    <ns:SupplierReferenceNo>D92387</ns:SupplierReferenceNo>
    <ns:BuyerReferenceNo>CO23049</ns:BuyerReferenceNo>
    <ns:VAT_RegistrationNo>IL 123444</ns:VAT_RegistrationNo>
    <ns:Address>
      <ns:Name1>Rehitey Dororn</ns:Name1>
	  <ns:Name2>Rehitey Dororn</ns:Name2>
      <ns:Street>Hasdna</ns:Street>
      <ns:City>Tira</ns:City>
      <ns:State></ns:State>
      <ns:PostalCode>23776</ns:PostalCode>
      <ns:Country>Israel</ns:Country>
      <ns:CountryCode>IL</ns:CountryCode>
    </ns:Address>
    <ns:Contact>
      <ns:FirstName>Ori</ns:FirstName>
      <ns:LastName>Abutbul</ns:LastName>
      <ns:Title>Mr</ns:Title>
      <ns:JobTItle>seller</ns:JobTItle>
      <ns:Phone>04-8293984</ns:Phone>
      <ns:Fax>04-8293984</ns:Fax>
      <ns:Email>oria@gmail.com</ns:Email>
    </ns:Contact>
  </ns:Supplier>
  <ns:DeliverTo>
    <ns:SupplierReferenceNo>D92387</ns:SupplierReferenceNo>
    <ns:BuyerReferenceNo>CO23049</ns:BuyerReferenceNo>
    <ns:VAT_RegistrationNo>IL 123444</ns:VAT_RegistrationNo>
    <ns:Address>
      <ns:Name1>Daniela Levi</ns:Name1>
	  <ns:Name2></ns:Name2>
      <ns:Street>Marganit 7</ns:Street>
      <ns:City>Nesher</ns:City>
      <ns:State></ns:State>
      <ns:PostalCode>98833</ns:PostalCode>
      <ns:Country>Israel</ns:Country>
      <ns:CountryCode>IL</ns:CountryCode>
    </ns:Address>
    <ns:Contact>
      <ns:FirstName>Daniela</ns:FirstName>
      <ns:LastName>Levi</ns:LastName>
      <ns:Title>Ms</ns:Title>
      <ns:JobTItle>singer</ns:JobTItle>
      <ns:Phone>04-912381</ns:Phone>
      <ns:Fax>08-912381</ns:Fax>
      <ns:Email>daniell@mail.com</ns:Email>
    </ns:Contact>
  </ns:DeliverTo>
  <ns:InvoiceTo>
    <ns:SupplierReferenceNo>D92387</ns:SupplierReferenceNo>
    <ns:BuyerReferenceNo>CO23049</ns:BuyerReferenceNo>
    <ns:VAT_RegistrationNo>IL 123444</ns:VAT_RegistrationNo>
    <ns:Address>
      <ns:Name1>Hava Albershtain</ns:Name1>
	  <ns:Name2>Hava Albershtain</ns:Name2>
      <ns:Street>frishman</ns:Street>
      <ns:City>Herzeliya</ns:City>
      <ns:State></ns:State>
      <ns:PostalCode>56982</ns:PostalCode>
      <ns:Country>Israel</ns:Country>
      <ns:CountryCode>IL</ns:CountryCode>
    </ns:Address>
    <ns:Contact>
      <ns:FirstName>Hava</ns:FirstName>
      <ns:LastName>Albershtain</ns:LastName>
      <ns:Title>Ms</ns:Title>
      <ns:JobTItle>singer</ns:JobTItle>
      <ns:Phone>050292871</ns:Phone>
      <ns:Fax>03-827364</ns:Fax>
      <ns:Email>havaa@gmail.com</ns:Email>
    </ns:Contact>
  </ns:InvoiceTo>
  <ns:POLine>
    <ns:LineNo>1</ns:LineNo>
    <ns:Product>
      <ns:SupplierPartID>pk27278</ns:SupplierPartID>
      <ns:SupplierPartDesc>table</ns:SupplierPartDesc>
      <ns:BuyerPartID>t7209</ns:BuyerPartID>
      <ns:BuyerPartDesc>table</ns:BuyerPartDesc>
      <ns:EAN>mk287392</ns:EAN>
    </ns:Product>
    <ns:Price>
      <ns:UnitPrice>12000</ns:UnitPrice>
      <ns:PricePerUnitOfMeasure>12000</ns:PricePerUnitOfMeasure>
      <ns:PriceQuotient>12000</ns:PriceQuotient>
    </ns:Price>
    <ns:Quantity>
      <ns:QuantityAmount>1</ns:QuantityAmount>
      <ns:PackCode>ygt5523</ns:PackCode>
      <ns:PackSize>9</ns:PackSize>
      <ns:UnitOfMeasure>kg</ns:UnitOfMeasure>
    </ns:Quantity>
    <ns:RequestedDeliveryDate>
      <ns:DateYear>2013</ns:DateYear>
      <ns:DateWeek>42</ns:DateWeek>
      <ns:Date>2013-11-20</ns:Date>
    </ns:RequestedDeliveryDate>
    <ns:Discount>
      <ns:Percentage>15</ns:Percentage>
      <ns:DaysDue>2013-11-20</ns:DaysDue>
    </ns:Discount>
    <ns:Amount>
      <ns:VAT_Rate>17</ns:VAT_Rate>
      <ns:VAT_Amount>2040</ns:VAT_Amount>
      <ns:Amount_ExclVAT>2040</ns:Amount_ExclVAT>
      <ns:Amount_InclVAT>2040</ns:Amount_InclVAT>
    </ns:Amount>
  </ns:POLine>
  <ns:OrderTotal>
    <ns:NumberOfLines>1</ns:NumberOfLines>
    <ns:TotalAmount>
      <ns:VAT_Rate>17</ns:VAT_Rate>
      <ns:VAT_Amount>2040</ns:VAT_Amount>
      <ns:Amount_ExclVAT>2040</ns:Amount_ExclVAT>
      <ns:Amount_InclVAT>2040</ns:Amount_InclVAT>
      <ns:VAT_AmountTotal>2040</ns:VAT_AmountTotal>
    </ns:TotalAmount>
  </ns:OrderTotal>
</ns:Order>