<?xml version="1.0" encoding="UTF-8"?>
<ns:Order xmlns:ns="Apertum" xmlns:xsi="http://www.w3.org/2001/XMLSchema-instance" xsi:schemaLocation="Apertum Apertum.xsd ">
  <ns:POHead>
    <ns:OrderDetails>
      <ns:SupplierOrderReference>IK2837</ns:SupplierOrderReference>
      <ns:BuyerOrderReference>CO382648</ns:BuyerOrderReference>
      <ns:TextHeader>Purchase Order No PO4750686</ns:TextHeader>
      <ns:TextFooter>Enjoy</ns:TextFooter>
      <ns:SupplierOrderDate>2012-12-13</ns:SupplierOrderDate>
      <ns:BuyerOrderDate>2012-12-13</ns:BuyerOrderDate>
    </ns:OrderDetails>
    <ns:Currency>
      <ns:CurrencyCode>USD</ns:CurrencyCode>
    </ns:Currency>
    <ns:TermsOfPayment>
      <ns:Description>Net 30</ns:Description>
      <ns:NetDays>30</ns:NetDays>
      <ns:Discount1>
        <ns:Percentage>5</ns:Percentage>
        <ns:DaysDue>2001-04-20</ns:DaysDue>
      </ns:Discount1>
      <ns:Discount2>
        <ns:Percentage>1</ns:Percentage>
        <ns:DaysDue>2001-01-01</ns:DaysDue>
      </ns:Discount2>
    </ns:TermsOfPayment>
    <ns:TermsOfDelivery>
      <ns:DelivType>Express Shipping with guaranteed delivery date</ns:DelivType>
      <ns:TransportType>air</ns:TransportType>
    </ns:TermsOfDelivery>
  </ns:POHead>
  <ns:Buyer>
    <ns:SupplierReferenceNo>IK2837</ns:SupplierReferenceNo>
    <ns:BuyerReferenceNo>CO382648</ns:BuyerReferenceNo>
    <ns:VAT_RegistrationNo>IL 23423</ns:VAT_RegistrationNo>
    <ns:Address>
      <ns:Name1>Eyal Shani</ns:Name1>
      <ns:Name2>Ido Cohen</ns:Name2>
      <ns:Street>Zahal</ns:Street>
      <ns:City>Herzeliya</ns:City>
      <ns:State>N/A</ns:State>
      <ns:PostalCode>56982</ns:PostalCode>
      <ns:Country>Israel</ns:Country>
      <ns:CountryCode>IL</ns:CountryCode>
    </ns:Address>
    <ns:Contact>
      <ns:FirstName>Eyal</ns:FirstName>
      <ns:LastName>Shani</ns:LastName>
      <ns:Title>Bsc</ns:Title>
      <ns:JobTItle>Engineer</ns:JobTItle>
      <ns:Phone>03-863216</ns:Phone>
      <ns:Fax>03-653092</ns:Fax>
      <ns:Email>EyalS@gmail.com</ns:Email>
    </ns:Contact>
  </ns:Buyer>
  <ns:Supplier>
    <ns:SupplierReferenceNo>IK2837</ns:SupplierReferenceNo>
    <ns:BuyerReferenceNo>CO382648</ns:BuyerReferenceNo>
    <ns:VAT_RegistrationNo>IL 23423</ns:VAT_RegistrationNo>
    <ns:Address>
      <ns:Name1>IKEA</ns:Name1>
	  <ns:Name2>IKEA</ns:Name2>
      <ns:Street>Giborey Israel</ns:Street>
      <ns:City>Netanya</ns:City>
      <ns:State>N/A</ns:State>
      <ns:PostalCode>60098</ns:PostalCode>
      <ns:Country>Israel</ns:Country>
      <ns:CountryCode>IL</ns:CountryCode>
    </ns:Address>
    <ns:Contact>
      <ns:FirstName>Avi</ns:FirstName>
      <ns:LastName>Cohen</ns:LastName>
      <ns:Title>Mr</ns:Title>
      <ns:JobTItle>teacher</ns:JobTItle>
      <ns:Phone>04-895623</ns:Phone>
      <ns:Fax>04-784512</ns:Fax>
      <ns:Email>avu@gmail.com</ns:Email>
    </ns:Contact>
  </ns:Supplier>
  <ns:DeliverTo>
    <ns:SupplierReferenceNo>IK2837</ns:SupplierReferenceNo>
    <ns:BuyerReferenceNo>CO382648</ns:BuyerReferenceNo>
    <ns:VAT_RegistrationNo>IL 23423</ns:VAT_RegistrationNo>
    <ns:Address>
      <ns:Name1>Eyal Shani</ns:Name1>
	  <ns:Name2>Ido Cohen</ns:Name2>
      <ns:Street>Zahal</ns:Street>
      <ns:City>Herzeliya</ns:City>
      <ns:State>N/A</ns:State>
      <ns:PostalCode>56982</ns:PostalCode>
      <ns:Country>Israel</ns:Country>
      <ns:CountryCode>IL</ns:CountryCode>
    </ns:Address>
    <ns:Contact>
      <ns:FirstName>Eyal</ns:FirstName>
      <ns:LastName>Shani</ns:LastName>
      <ns:Title>Mr</ns:Title>
      <ns:JobTItle>cook</ns:JobTItle>
      <ns:Phone>04-895623</ns:Phone>
      <ns:Fax>08-987654</ns:Fax>
      <ns:Email>eyal@mail.com</ns:Email>
    </ns:Contact>
  </ns:DeliverTo>
  <ns:InvoiceTo>
    <ns:SupplierReferenceNo>IK2837</ns:SupplierReferenceNo>
    <ns:BuyerReferenceNo>CO382648</ns:BuyerReferenceNo>
    <ns:VAT_RegistrationNo>IL 23423</ns:VAT_RegistrationNo>
    <ns:Address>
      <ns:Name1>Mor Shani</ns:Name1>
	  <ns:Name2>Mor Shani</ns:Name2>
      <ns:Street>Zahal</ns:Street>
      <ns:City>Herzeliya</ns:City>
      <ns:State>N/A</ns:State>
      <ns:PostalCode>56982</ns:PostalCode>
      <ns:Country>Israel</ns:Country>
      <ns:CountryCode>IL</ns:CountryCode>
    </ns:Address>
    <ns:Contact>
      <ns:FirstName>Mor</ns:FirstName>
      <ns:LastName>Shani</ns:LastName>
      <ns:Title>PHD</ns:Title>
      <ns:JobTItle>nurse</ns:JobTItle>
      <ns:Phone>054321896</ns:Phone>
      <ns:Fax>03-653092</ns:Fax>
      <ns:Email>mors@gmail.com</ns:Email>
    </ns:Contact>
  </ns:InvoiceTo>
  <ns:POLine>
    <ns:LineNo>1</ns:LineNo>
    <ns:Product>
      <ns:SupplierPartID>de75356</ns:SupplierPartID>
      <ns:SupplierPartDesc>saucepan black</ns:SupplierPartDesc>
      <ns:BuyerPartID>v533</ns:BuyerPartID>
      <ns:BuyerPartDesc>saucepan black</ns:BuyerPartDesc>
      <ns:EAN>vg664feef</ns:EAN>
    </ns:Product>
    <ns:Price>
      <ns:UnitPrice>100</ns:UnitPrice>
      <ns:PricePerUnitOfMeasure>50.76</ns:PricePerUnitOfMeasure>
      <ns:PriceQuotient>376.9</ns:PriceQuotient>
    </ns:Price>
    <ns:Quantity>
      <ns:QuantityAmount>5</ns:QuantityAmount>
      <ns:PackCode>ygt5554</ns:PackCode>
      <ns:PackSize>60</ns:PackSize>
      <ns:UnitOfMeasure>kg</ns:UnitOfMeasure>
    </ns:Quantity>
    <ns:RequestedDeliveryDate>
      <ns:DateYear>2013</ns:DateYear>
      <ns:DateWeek>45</ns:DateWeek>
      <ns:Date>2012-12-20</ns:Date>
    </ns:RequestedDeliveryDate>
    <ns:Discount>
      <ns:Percentage>5</ns:Percentage>
      <ns:DaysDue>2012-12-20</ns:DaysDue>
    </ns:Discount>
    <ns:Amount>
      <ns:VAT_Rate>17</ns:VAT_Rate>
      <ns:VAT_Amount>8.6</ns:VAT_Amount>
      <ns:Amount_ExclVAT>50.76</ns:Amount_ExclVAT>
      <ns:Amount_InclVAT>59.36</ns:Amount_InclVAT>
    </ns:Amount>
  </ns:POLine>
  <ns:OrderTotal>
    <ns:NumberOfLines>1</ns:NumberOfLines>
    <ns:TotalAmount>
      <ns:VAT_Rate>17</ns:VAT_Rate>
      <ns:VAT_Amount>8.6</ns:VAT_Amount>
      <ns:Amount_ExclVAT>50.76</ns:Amount_ExclVAT>
      <ns:Amount_InclVAT>59.36</ns:Amount_InclVAT>
      <ns:VAT_AmountTotal>9</ns:VAT_AmountTotal>
    </ns:TotalAmount>
  </ns:OrderTotal>
</ns:Order>