<?xml version="1.0" encoding="UTF-8"?>
<ns:Order xmlns:ns="Apertum" xmlns:xsi="http://www.w3.org/2001/XMLSchema-instance" xsi:schemaLocation="Apertum Apertum.xsd ">
  <ns:POHead>
    <ns:OrderDetails>
      <ns:SupplierOrderReference>FT2093</ns:SupplierOrderReference>
      <ns:BuyerOrderReference>CO102983</ns:BuyerOrderReference>
      <ns:TextHeader>Purchase Order No PO400097</ns:TextHeader>
      <ns:TextFooter>Enjoy</ns:TextFooter>
      <ns:SupplierOrderDate>2013-12-13</ns:SupplierOrderDate>
      <ns:BuyerOrderDate>2013-12-13</ns:BuyerOrderDate>
    </ns:OrderDetails>
    <ns:Currency>
      <ns:CurrencyCode>DZD</ns:CurrencyCode>
    </ns:Currency>
    <ns:TermsOfPayment>
      <ns:Description>Net 30</ns:Description>
      <ns:NetDays>30</ns:NetDays>
      <ns:Discount1>
        <ns:Percentage>5</ns:Percentage>
        <ns:DaysDue>2013-11-24</ns:DaysDue>
      </ns:Discount1>
      <ns:Discount2>
        <ns:Percentage>1</ns:Percentage>
        <ns:DaysDue>2014-11-24</ns:DaysDue>
      </ns:Discount2>
    </ns:TermsOfPayment>
    <ns:TermsOfDelivery>
      <ns:DelivType>standarat Shipping</ns:DelivType>
      <ns:TransportType>air</ns:TransportType>
    </ns:TermsOfDelivery>
  </ns:POHead>
  <ns:Buyer>
    <ns:SupplierReferenceNo>FT2093</ns:SupplierReferenceNo>
    <ns:BuyerReferenceNo>CO102983</ns:BuyerReferenceNo>
    <ns:VAT_RegistrationNo>IL 29038</ns:VAT_RegistrationNo>
    <ns:Address>
      <ns:Name1>Shikma Shoshana</ns:Name1>
	  <ns:Name2></ns:Name2>
      <ns:Street>Hasadna</ns:Street>
      <ns:City>Tirat Carmel</ns:City>
      <ns:State></ns:State>
      <ns:PostalCode>78788</ns:PostalCode>
      <ns:Country>Israel</ns:Country>
      <ns:CountryCode>IL</ns:CountryCode>
    </ns:Address>
    <ns:Contact>
      <ns:FirstName>Shikam</ns:FirstName>
      <ns:LastName>Shoshana</ns:LastName>
      <ns:Title>Bsc</ns:Title>
      <ns:JobTItle>Engineer</ns:JobTItle>
      <ns:Phone>04-098745</ns:Phone>
      <ns:Fax>04-890788</ns:Fax>
      <ns:Email>shikmas@gmail.com</ns:Email>
    </ns:Contact>
  </ns:Buyer>
  <ns:Supplier>
    <ns:SupplierReferenceNo>FT2093</ns:SupplierReferenceNo>
    <ns:BuyerReferenceNo>CO102983</ns:BuyerReferenceNo>
    <ns:VAT_RegistrationNo>IL 29038</ns:VAT_RegistrationNo>
    <ns:Address>
      <ns:Name1>Fitness</ns:Name1>
	  <ns:Name2>Fitness</ns:Name2>
      <ns:Street>Mezada</ns:Street>
      <ns:City>Nahariya</ns:City>
      <ns:State></ns:State>
      <ns:PostalCode>67444</ns:PostalCode>
      <ns:Country>Israel</ns:Country>
      <ns:CountryCode>IL</ns:CountryCode>
    </ns:Address>
    <ns:Contact>
      <ns:FirstName>Avi</ns:FirstName>
      <ns:LastName>Levi</ns:LastName>
      <ns:Title>Mr</ns:Title>
      <ns:JobTItle>seller</ns:JobTItle>
      <ns:Phone>04-899878</ns:Phone>
      <ns:Fax>04-789989</ns:Fax>
      <ns:Email>avil@gmail.com</ns:Email>
    </ns:Contact>
  </ns:Supplier>
  <ns:DeliverTo>
    <ns:SupplierReferenceNo>FT2093</ns:SupplierReferenceNo>
    <ns:BuyerReferenceNo>CO102983</ns:BuyerReferenceNo>
    <ns:VAT_RegistrationNo>IL 29038</ns:VAT_RegistrationNo>
    <ns:Address>
      <ns:Name1>Shikma Shoshana</ns:Name1>
	  <ns:Name2></ns:Name2>
      <ns:Street>Hasadna</ns:Street>
      <ns:City>Tirat Carmel</ns:City>
      <ns:State></ns:State>
      <ns:PostalCode>78878</ns:PostalCode>
      <ns:Country>Israel</ns:Country>
      <ns:CountryCode>IL</ns:CountryCode>
    </ns:Address>
    <ns:Contact>
      <ns:FirstName>Shikma</ns:FirstName>
      <ns:LastName>Shoshana</ns:LastName>
      <ns:Title>BSc</ns:Title>
      <ns:JobTItle>Engeneer</ns:JobTItle>
      <ns:Phone>04-098745</ns:Phone>
      <ns:Fax>04-098745</ns:Fax>
      <ns:Email>shikmas@gmail.com</ns:Email>
    </ns:Contact>
  </ns:DeliverTo>
  <ns:InvoiceTo>
    <ns:SupplierReferenceNo>FT2093</ns:SupplierReferenceNo>
    <ns:BuyerReferenceNo>CO102983</ns:BuyerReferenceNo>
    <ns:VAT_RegistrationNo>IL 29038</ns:VAT_RegistrationNo>
    <ns:Address>
      <ns:Name1>Shikma Shoshana</ns:Name1>
	  <ns:Name2>Shikma Shoshana</ns:Name2>
      <ns:Street>Hasadna</ns:Street>
      <ns:City>Tirat Carmel</ns:City>
      <ns:State></ns:State>
      <ns:PostalCode>787878</ns:PostalCode>
      <ns:Country>Israel</ns:Country>
      <ns:CountryCode>IL</ns:CountryCode>
    </ns:Address>
    <ns:Contact>
      <ns:FirstName>Shikma</ns:FirstName>
      <ns:LastName>Shoshana</ns:LastName>
      <ns:Title>BSc</ns:Title>
      <ns:JobTItle>Engineer</ns:JobTItle>
      <ns:Phone>04837265</ns:Phone>
      <ns:Fax>04638923</ns:Fax>
      <ns:Email>shikmas@gmail.com</ns:Email>
    </ns:Contact>
  </ns:InvoiceTo>
  <ns:POLine>
    <ns:LineNo>1</ns:LineNo>
    <ns:Product>
      <ns:SupplierPartID>gy382729</ns:SupplierPartID>
      <ns:SupplierPartDesc>bars</ns:SupplierPartDesc>
      <ns:BuyerPartID>h473</ns:BuyerPartID>
      <ns:BuyerPartDesc>bars</ns:BuyerPartDesc>
      <ns:EAN>dj7783kk</ns:EAN>
    </ns:Product>
    <ns:Price>
      <ns:UnitPrice>4</ns:UnitPrice>
      <ns:PricePerUnitOfMeasure>2</ns:PricePerUnitOfMeasure>
      <ns:PriceQuotient>37</ns:PriceQuotient>
    </ns:Price>
    <ns:Quantity>
      <ns:QuantityAmount>5</ns:QuantityAmount>
      <ns:PackCode>hhy7765</ns:PackCode>
      <ns:PackSize>45</ns:PackSize>
      <ns:UnitOfMeasure>l</ns:UnitOfMeasure>
    </ns:Quantity>
    <ns:RequestedDeliveryDate>
      <ns:DateYear>2013</ns:DateYear>
      <ns:DateWeek>23</ns:DateWeek>
      <ns:Date>2013-04-20</ns:Date>
    </ns:RequestedDeliveryDate>
    <ns:Discount>
      <ns:Percentage>5</ns:Percentage>
      <ns:DaysDue>2013-12-20</ns:DaysDue>
    </ns:Discount>
    <ns:Amount>
      <ns:VAT_Rate>17</ns:VAT_Rate>
      <ns:VAT_Amount>8.6</ns:VAT_Amount>
      <ns:Amount_ExclVAT>50.76</ns:Amount_ExclVAT>
      <ns:Amount_InclVAT>59.36</ns:Amount_InclVAT>
    </ns:Amount>
  </ns:POLine>
  <ns:OrderTotal>
    <ns:NumberOfLines>1</ns:NumberOfLines>
    <ns:TotalAmount>
      <ns:VAT_Rate>17</ns:VAT_Rate>
      <ns:VAT_Amount>8.6</ns:VAT_Amount>
      <ns:Amount_ExclVAT>50.76</ns:Amount_ExclVAT>
      <ns:Amount_InclVAT>59.36</ns:Amount_InclVAT>
      <ns:VAT_AmountTotal>9</ns:VAT_AmountTotal>
    </ns:TotalAmount>
  </ns:OrderTotal>
</ns:Order>