<?xml version="1.0" encoding="UTF-8"?>
<ns:Order xmlns:ns="Apertum" xmlns:xsi="http://www.w3.org/2001/XMLSchema-instance" xsi:schemaLocation="Apertum Apertum.xsd ">
  <ns:POHead>
    <ns:OrderDetails>
      <ns:SupplierOrderReference>ALTR4589</ns:SupplierOrderReference>
      <ns:BuyerOrderReference>CU4895</ns:BuyerOrderReference>
      <ns:TextHeader>Purchase Order No PO100896</ns:TextHeader>
      <ns:TextFooter>Enjoy</ns:TextFooter>
      <ns:SupplierOrderDate>2013-10-16</ns:SupplierOrderDate>
      <ns:BuyerOrderDate>2012-10-16</ns:BuyerOrderDate>
    </ns:OrderDetails>
    <ns:Currency>
      <ns:CurrencyCode>NIS</ns:CurrencyCode>
    </ns:Currency>
    <ns:TermsOfPayment>
      <ns:Description></ns:Description>
      <ns:NetDays>9</ns:NetDays>
      <ns:Discount1>
        <ns:Percentage>78</ns:Percentage>
        <ns:DaysDue>2050-04-20</ns:DaysDue>
      </ns:Discount1>
      <ns:Discount2>
        <ns:Percentage>56</ns:Percentage>
        <ns:DaysDue>2050-01-01</ns:DaysDue>
      </ns:Discount2>
    </ns:TermsOfPayment>
    <ns:TermsOfDelivery>
      <ns:DelivType></ns:DelivType>
      <ns:TransportType></ns:TransportType>
    </ns:TermsOfDelivery>
  </ns:POHead>
  <ns:Buyer>
    <ns:SupplierReferenceNo>ALTR4589</ns:SupplierReferenceNo>
    <ns:BuyerReferenceNo>CU4895</ns:BuyerReferenceNo>
    <ns:VAT_RegistrationNo>IL 89654</ns:VAT_RegistrationNo>
    <ns:Address>
      <ns:Name1> Dr. Micha Bulis</ns:Name1>
	  <ns:Name2></ns:Name2>
      <ns:Street>Geula 7</ns:Street>
      <ns:City>Ramat Yshay</ns:City>
      <ns:State></ns:State>
      <ns:PostalCode>56987</ns:PostalCode>
      <ns:Country>Israel</ns:Country>
      <ns:CountryCode>IL</ns:CountryCode>
    </ns:Address>
    <ns:Contact>
      <ns:FirstName>Micha</ns:FirstName>
      <ns:LastName>Bulis</ns:LastName>
      <ns:Title></ns:Title>
      <ns:JobTItle>Manager</ns:JobTItle>
      <ns:Phone>04-863216</ns:Phone>
      <ns:Fax>04-653092</ns:Fax>
      <ns:Email>michab@gmail.com</ns:Email>
    </ns:Contact>
  </ns:Buyer>
  <ns:Supplier>
    <ns:SupplierReferenceNo>ALTR4589</ns:SupplierReferenceNo>
    <ns:BuyerReferenceNo>CU4895</ns:BuyerReferenceNo>
    <ns:VAT_RegistrationNo>IL 89654</ns:VAT_RegistrationNo>
    <ns:Address>
      <ns:Name1>veribo</ns:Name1>
	  <ns:Name2>veribo</ns:Name2>
      <ns:Street>Malahey Israel</ns:Street>
      <ns:City>Tel Hanan</ns:City>
      <ns:State></ns:State>
      <ns:PostalCode>60098</ns:PostalCode>
      <ns:Country>Israel</ns:Country>
      <ns:CountryCode>IL</ns:CountryCode>
    </ns:Address>
    <ns:Contact>
      <ns:FirstName>Avi</ns:FirstName>
      <ns:LastName>Levi</ns:LastName>
      <ns:Title></ns:Title>
      <ns:JobTItle>seller</ns:JobTItle>
      <ns:Phone>04-895623</ns:Phone>
      <ns:Fax>04-784512</ns:Fax>
      <ns:Email>avl@gmail.com</ns:Email>
    </ns:Contact>
  </ns:Supplier>
  <ns:DeliverTo>
    <ns:SupplierReferenceNo>ALTR4589</ns:SupplierReferenceNo>
    <ns:BuyerReferenceNo>CU4895</ns:BuyerReferenceNo>
    <ns:VAT_RegistrationNo>IL 89654</ns:VAT_RegistrationNo>
    <ns:Address>
      <ns:Name1> Dr. Micha Bulis</ns:Name1>
	  <ns:Name2></ns:Name2>
      <ns:Street>Geula 7</ns:Street>
      <ns:City>Ramat Yshay</ns:City>
      <ns:State></ns:State>
      <ns:PostalCode>56987</ns:PostalCode>
      <ns:Country>Israel</ns:Country>
      <ns:CountryCode>IL</ns:CountryCode>
    </ns:Address>
    <ns:Contact>
      <ns:FirstName>Eyal</ns:FirstName>
      <ns:LastName>Banay</ns:LastName>
      <ns:Title>Mr</ns:Title>
      <ns:JobTItle>cook</ns:JobTItle>
      <ns:Phone>04-895623</ns:Phone>
      <ns:Fax>04-987654</ns:Fax>
      <ns:Email>eyal@mail.com</ns:Email>
    </ns:Contact>
  </ns:DeliverTo>
  <ns:InvoiceTo>
    <ns:SupplierReferenceNo>ALTR4589</ns:SupplierReferenceNo>
    <ns:BuyerReferenceNo>CU4895</ns:BuyerReferenceNo>
    <ns:VAT_RegistrationNo>IL 89654</ns:VAT_RegistrationNo>
    <ns:Address>
      <ns:Name1> Dr. Micha Bulis</ns:Name1>
	  <ns:Name2> Dr. Micha Bulis</ns:Name2>
      <ns:Street>Geula 7</ns:Street>
      <ns:City>Ramat Yshay</ns:City>
      <ns:State></ns:State>
      <ns:PostalCode>56987</ns:PostalCode>
      <ns:Country>Israel</ns:Country>
      <ns:CountryCode>IL</ns:CountryCode>
    </ns:Address>
    <ns:Contact>
      <ns:FirstName>Mihal</ns:FirstName>
      <ns:LastName>Bulis</ns:LastName>
      <ns:Title>Ms</ns:Title>
      <ns:JobTItle>Manager</ns:JobTItle>
      <ns:Phone>054321896</ns:Phone>
      <ns:Fax>04-653092</ns:Fax>
      <ns:Email>mihab@gmail.com</ns:Email>
    </ns:Contact>
  </ns:InvoiceTo>
  <ns:POLine>
    <ns:LineNo>1</ns:LineNo>
    <ns:Product>
      <ns:SupplierPartID>12234</ns:SupplierPartID>
      <ns:SupplierPartDesc>yeuz</ns:SupplierPartDesc>
      <ns:BuyerPartID>r647</ns:BuyerPartID>
      <ns:BuyerPartDesc>consulting</ns:BuyerPartDesc>
      <ns:EAN>d45568</ns:EAN>
    </ns:Product>
    <ns:Price>
      <ns:UnitPrice>1</ns:UnitPrice>
      <ns:PricePerUnitOfMeasure>1</ns:PricePerUnitOfMeasure>
      <ns:PriceQuotient>10</ns:PriceQuotient>
    </ns:Price>
    <ns:Quantity>
      <ns:QuantityAmount>5</ns:QuantityAmount>
      <ns:PackCode>we7732</ns:PackCode>
      <ns:PackSize>34</ns:PackSize>
      <ns:UnitOfMeasure>unit</ns:UnitOfMeasure>
    </ns:Quantity>
    <ns:RequestedDeliveryDate>
      <ns:DateYear>2145</ns:DateYear>
      <ns:DateWeek>23</ns:DateWeek>
      <ns:Date>2045-12-20</ns:Date>
    </ns:RequestedDeliveryDate>
    <ns:Discount>
      <ns:Percentage>50</ns:Percentage>
      <ns:DaysDue>2043-12-20</ns:DaysDue>
    </ns:Discount>
    <ns:Amount>
      <ns:VAT_Rate>20</ns:VAT_Rate>
      <ns:VAT_Amount>0.17</ns:VAT_Amount>
      <ns:Amount_ExclVAT>20</ns:Amount_ExclVAT>
      <ns:Amount_InclVAT>27.3</ns:Amount_InclVAT>
    </ns:Amount>
  </ns:POLine>
  <ns:OrderTotal>
    <ns:NumberOfLines>1</ns:NumberOfLines>
    <ns:TotalAmount>
      <ns:VAT_Rate>20</ns:VAT_Rate>
      <ns:VAT_Amount>0.17</ns:VAT_Amount>
      <ns:Amount_ExclVAT>20</ns:Amount_ExclVAT>
      <ns:Amount_InclVAT>27.3</ns:Amount_InclVAT>
      <ns:VAT_AmountTotal>743</ns:VAT_AmountTotal>
    </ns:TotalAmount>
  </ns:OrderTotal>
</ns:Order>