<?xml version="1.0" encoding="UTF-8"?>
<ns:Order xmlns:ns="Apertum" xmlns:xsi="http://www.w3.org/2001/XMLSchema-instance" xsi:schemaLocation="Apertum Apertum.xsd ">
  <ns:POHead>
    <ns:OrderDetails>
      <ns:SupplierOrderReference>GR38291</ns:SupplierOrderReference>
      <ns:BuyerOrderReference>CO10929</ns:BuyerOrderReference>
      <ns:TextHeader>Purchase Order No PO475983240</ns:TextHeader>
      <ns:TextFooter>Enjoy</ns:TextFooter>
      <ns:SupplierOrderDate>2014-03-02</ns:SupplierOrderDate>
      <ns:BuyerOrderDate>2012-03-02</ns:BuyerOrderDate>
    </ns:OrderDetails>
    <ns:Currency>
      <ns:CurrencyCode>KPW</ns:CurrencyCode>
    </ns:Currency>
    <ns:TermsOfPayment>
      <ns:Description>Net 45</ns:Description>
      <ns:NetDays>45</ns:NetDays>
      <ns:Discount1>
        <ns:Percentage>15</ns:Percentage>
        <ns:DaysDue>2001-05-24</ns:DaysDue>
      </ns:Discount1>
      <ns:Discount2>
        <ns:Percentage>20</ns:Percentage>
        <ns:DaysDue>2012-05-12</ns:DaysDue>
      </ns:Discount2>
    </ns:TermsOfPayment>
    <ns:TermsOfDelivery>
      <ns:DelivType>Standart Shipping </ns:DelivType>
      <ns:TransportType>sea</ns:TransportType>
    </ns:TermsOfDelivery>
  </ns:POHead>
  <ns:Buyer>
    <ns:SupplierReferenceNo>GR38291</ns:SupplierReferenceNo>
    <ns:BuyerReferenceNo>CO10929</ns:BuyerReferenceNo>
    <ns:VAT_RegistrationNo>IL 12346</ns:VAT_RegistrationNo>
    <ns:Address>
      <ns:Name1>Alona Horev</ns:Name1>
	  <ns:Name2></ns:Name2>
      <ns:Street>Khavazelet 33</ns:Street>
      <ns:City>Hod Hashron</ns:City>
      <ns:State></ns:State>
      <ns:PostalCode>23493</ns:PostalCode>
      <ns:Country>Israel</ns:Country>
      <ns:CountryCode>IL</ns:CountryCode>
    </ns:Address>
    <ns:Contact>
      <ns:FirstName>Alona</ns:FirstName>
      <ns:LastName>Horev</ns:LastName>
      <ns:Title>Bsc</ns:Title>
      <ns:JobTItle>Engineer</ns:JobTItle>
      <ns:Phone>03-123864</ns:Phone>
      <ns:Fax>03-123864</ns:Fax>
      <ns:Email>alonah@gmail.com</ns:Email>
    </ns:Contact>
  </ns:Buyer>
  <ns:Supplier>
    <ns:SupplierReferenceNo>GR38291</ns:SupplierReferenceNo>
    <ns:BuyerReferenceNo>CO10929</ns:BuyerReferenceNo>
    <ns:VAT_RegistrationNo>IL 12346</ns:VAT_RegistrationNo>
    <ns:Address>
      <ns:Name1>Modgal</ns:Name1>
	  <ns:Name2></ns:Name2>
      <ns:Street>Sderot Hanasy</ns:Street>
      <ns:City>Netanya</ns:City>
      <ns:State></ns:State>
      <ns:PostalCode>09835</ns:PostalCode>
      <ns:Country>Israel</ns:Country>
      <ns:CountryCode>IL</ns:CountryCode>
    </ns:Address>
    <ns:Contact>
      <ns:FirstName>Ziva</ns:FirstName>
      <ns:LastName>Amir</ns:LastName>
      <ns:Title>Ms</ns:Title>
      <ns:JobTItle>Sales</ns:JobTItle>
      <ns:Phone>09-837463</ns:Phone>
      <ns:Fax>09-837463</ns:Fax>
      <ns:Email>ziva@gmail.com</ns:Email>
    </ns:Contact>
  </ns:Supplier>
  <ns:DeliverTo>
    <ns:SupplierReferenceNo>GR38291</ns:SupplierReferenceNo>
    <ns:BuyerReferenceNo>CO10929</ns:BuyerReferenceNo>
    <ns:VAT_RegistrationNo>IL 23423</ns:VAT_RegistrationNo>
    <ns:Address>
      <ns:Name1>Alona Horev</ns:Name1>
	  <ns:Name2></ns:Name2>
      <ns:Street>Khavazelet 33</ns:Street>
      <ns:City>Hod Hashron</ns:City>
      <ns:State></ns:State>
      <ns:PostalCode>23493</ns:PostalCode>
      <ns:Country>Israel</ns:Country>
      <ns:CountryCode>IL</ns:CountryCode>
    </ns:Address>
    <ns:Contact>
      <ns:FirstName>Alona</ns:FirstName>
      <ns:LastName>Horev</ns:LastName>
      <ns:Title>Ms</ns:Title>
      <ns:JobTItle>Engineer</ns:JobTItle>
      <ns:Phone>03-123864</ns:Phone>
      <ns:Fax>03-123864</ns:Fax>
      <ns:Email>eyal@mail.com</ns:Email>
    </ns:Contact>
  </ns:DeliverTo>
  <ns:InvoiceTo>
    <ns:SupplierReferenceNo>GR38291</ns:SupplierReferenceNo>
    <ns:BuyerReferenceNo>CO10929</ns:BuyerReferenceNo>
    <ns:VAT_RegistrationNo>IL 12346</ns:VAT_RegistrationNo>
    <ns:Address>
      <ns:Name1>Alona Horev</ns:Name1>
	  <ns:Name2>Alona Horev</ns:Name2>
      <ns:Street>Khavazelet</ns:Street>
      <ns:City>Hod Hashron</ns:City>
      <ns:State></ns:State>
      <ns:PostalCode>23493</ns:PostalCode>
      <ns:Country>Israel</ns:Country>
      <ns:CountryCode>IL</ns:CountryCode>
    </ns:Address>
    <ns:Contact>
      <ns:FirstName>Alona</ns:FirstName>
      <ns:LastName>Horev</ns:LastName>
      <ns:Title>Bsc</ns:Title>
      <ns:JobTItle>Engineer</ns:JobTItle>
      <ns:Phone>053846372</ns:Phone>
      <ns:Fax>03-6530920</ns:Fax>
      <ns:Email>alonah@gmail.com</ns:Email>
    </ns:Contact>
  </ns:InvoiceTo>
  <ns:POLine>
    <ns:LineNo>1</ns:LineNo>
    <ns:Product>
      <ns:SupplierPartID>293489</ns:SupplierPartID>
      <ns:SupplierPartDesc>iron</ns:SupplierPartDesc>
      <ns:BuyerPartID>d203</ns:BuyerPartID>
      <ns:BuyerPartDesc>iron</ns:BuyerPartDesc>
      <ns:EAN>alskd83749</ns:EAN>
    </ns:Product>
    <ns:Price>
      <ns:UnitPrice>23</ns:UnitPrice>
      <ns:PricePerUnitOfMeasure>2.3</ns:PricePerUnitOfMeasure>
      <ns:PriceQuotient>2.3</ns:PriceQuotient>
    </ns:Price>
    <ns:Quantity>
      <ns:QuantityAmount>20</ns:QuantityAmount>
      <ns:PackCode>8474he</ns:PackCode>
      <ns:PackSize>200</ns:PackSize>
      <ns:UnitOfMeasure>kg</ns:UnitOfMeasure>
    </ns:Quantity>
    <ns:RequestedDeliveryDate>
      <ns:DateYear>2013</ns:DateYear>
      <ns:DateWeek>23</ns:DateWeek>
      <ns:Date>2012-06-12</ns:Date>
    </ns:RequestedDeliveryDate>
    <ns:Discount>
      <ns:Percentage>15</ns:Percentage>
      <ns:DaysDue>2014-12-20</ns:DaysDue>
    </ns:Discount>
    <ns:Amount>
      <ns:VAT_Rate>17</ns:VAT_Rate>
      <ns:VAT_Amount>23</ns:VAT_Amount>
      <ns:Amount_ExclVAT>20.3</ns:Amount_ExclVAT>
      <ns:Amount_InclVAT>20.3</ns:Amount_InclVAT>
    </ns:Amount>
  </ns:POLine>
  <ns:OrderTotal>
    <ns:NumberOfLines>1</ns:NumberOfLines>
    <ns:TotalAmount>
      <ns:VAT_Rate>17</ns:VAT_Rate>
      <ns:VAT_Amount>23</ns:VAT_Amount>
      <ns:Amount_ExclVAT>20.3</ns:Amount_ExclVAT>
      <ns:Amount_InclVAT>20.3</ns:Amount_InclVAT>
      <ns:VAT_AmountTotal>12</ns:VAT_AmountTotal>
    </ns:TotalAmount>
  </ns:OrderTotal>
</ns:Order>